{
  "$schema": "../schema/graflume.features.schema.json",
  "schemaVersion": 1,
  "verifiedAt": "2026-08-26",
  "statusVocabulary": ["supported", "partial", "planned", "research"],
  "commonFoundations": [
    {
      "id": "transform-dataflow",
      "status": "supported",
      "summary": "Ordered function-free transforms, top-level and layer pipelines, deterministic row lineage, parameters, seeded operations, aggregation counts, named sources, reusable branches and a shared transform DAG are supported.",
      "unlocks": [
        "area",
        "bar",
        "distribution",
        "interval",
        "line",
        "heatmap",
        "map",
        "technical-indicator"
      ]
    },
    {
      "id": "encoding-scale-registry",
      "status": "supported",
      "summary": "A closed portable encoding map, conditional mark channels, geographic and trading channels, 17 positional/categorical/probability/temporal scale types, four color scale types, and shared or independent multi-view domains, axes, legends and colorbars are supported.",
      "unlocks": ["scatter", "heatmap", "parallel", "polar", "smith", "ternary"]
    },
    {
      "id": "analytic-interaction",
      "status": "supported",
      "summary": "A closed immutable v1 store, union/intersection semantics, point/interval/rectangle/axis/lasso state, Canvas pointer/touch and keyboard-authored geometry, continuous and categorical pixel/domain navigation, linked multi-view state, and lineage-preserving selection-driven filtering are supported. Spatial analytic selection remains a separate later boundary.",
      "unlocks": ["scatter", "heatmap", "parallel", "scatter-matrix", "map", "combination"]
    },
    {
      "id": "composition-resolve",
      "status": "supported",
      "summary": "Legacy flat layers and the closed layer/facet/repeat/hconcat/vconcat/concat/inset Canvas composition grammar are supported with deterministic bounded layout, scoped semantic and lineage identities, named axes, shared or independent multi-view domains/axes/legends/colorbars, linked view state, per-layer transforms, z-order and clipping. Facet virtualization, renderer mixing and Spatial composition remain later roadmap work.",
      "unlocks": ["combination", "distribution", "interval", "timeline", "technical-indicator"]
    },
    {
      "id": "semantic-index-accessibility",
      "status": "supported",
      "summary": "All Canvas families compile a bounded lineage-aware semantic index and expose a virtualized native explorer with full roving traversal, focus-ring, tooltip and selection synchronization. Spatial GPU views expose projected roving traversal and active-descendant synchronization, while a bounded stable-key focus store links Canvas and Spatial views through a portable authored contract.",
      "unlocks": ["table", "all-canvas", "all-spatial"]
    },
    {
      "id": "label-layout-authoring",
      "status": "supported",
      "summary": "All 41 Canvas families support function-free reusable markLabels with stable-key portable positions, deterministic automatic collision placement, connectors, editing handles, pointer drag, keyboard selection and nudging, grid/mark/plot snapping, bounded undo/redo, runtime import/export events and accessible instructions/live status. Annotation adds a closed data-coordinate point/rule/band/label/callout registry with drag, resize and history.",
      "unlocks": ["all-canvas", "pie", "bubble", "map", "chord", "funnel", "annotation", "network"]
    },
    {
      "id": "incremental-worker-binary",
      "status": "supported",
      "summary": "Stable-key append/upsert/replaceLast uses bounded ring storage, explicit reject/drop-oldest/coalesce queues, count/event-time retention and replay. Row-local transforms recompute changed keys with exact global fallback; the frame runtime adds RAF coalescing, cancellation, pause/follow-live and lazy bounded history. Automatic module Workers accept row, typed-column and Arrow-compatible binary envelopes, injected JavaScript/WASM adapters and worker-owned renderers with bounded work and cancellation.",
      "unlocks": ["line", "scatter", "candlestick", "map", "network", "combination"]
    }
  ],
  "families": [
    {
      "id": "annotation",
      "coordinate": "overlay",
      "status": "supported",
      "supported": [
        "datum/layer/range/plot targets",
        "callout connectors",
        "collision-aware placement",
        "runtime CRUD",
        "visibility and serialization",
        "data-coordinate primitive registry",
        "keyboard authoring",
        "drag and resize handles",
        "undo and redo"
      ],
      "p0": [],
      "p1": ["image/channel/freehand/measure tools", "snapping", "filter and side panel"],
      "p2": ["collaborative authorship", "comments and locks", "templates"],
      "dependencies": [
        "label-layout-authoring",
        "analytic-interaction",
        "semantic-index-accessibility"
      ]
    },
    {
      "id": "area",
      "coordinate": "cartesian",
      "status": "supported",
      "supported": [
        "zero-baseline area",
        "shared linear, step, monotone, natural, basis and cardinal curves with explicit missing-value policy",
        "polygon",
        "grouped, stacked, 100 percent and diverging long-form series",
        "zero, normalize, silhouette and wiggle offsets with explicit series order",
        "per-observation semantic and datum hit targets",
        "named and branched transform DAG reuse",
        "worker-bounded incremental stack updates",
        "automatic series labels",
        "data-domain navigation"
      ],
      "p0": [],
      "p1": ["horizon", "bump and area-bump", "fan and threshold bands", "radial area"],
      "p2": ["gradient and per-segment hit testing", "renderer parity and LOD"],
      "dependencies": ["transform-dataflow", "encoding-scale-registry", "incremental-worker-binary"]
    },
    {
      "id": "bar",
      "coordinate": "cartesian",
      "status": "supported",
      "supported": [
        "horizontal and vertical bars",
        "grouped layers",
        "positive and negative baseline",
        "single-layer grouped, stacked, 100 percent and diverging series",
        "signed stack totals, percentages, source lineage and datum hits",
        "stack ordering and zero/normalize offsets",
        "bullet/lollipop/pictorial/cylinder/pyramid/variable-width modes",
        "weighted count",
        "interactive sort and rank",
        "automatic total and segment labels",
        "worker-bounded virtualization"
      ],
      "p0": [],
      "p1": ["butterfly and tornado", "race", "nested dodge", "pattern and drill"],
      "p2": ["cross-renderer dense-category LOD", "progressive labels"],
      "dependencies": [
        "transform-dataflow",
        "encoding-scale-registry",
        "label-layout-authoring",
        "semantic-index-accessibility"
      ]
    },
    {
      "id": "bubble",
      "coordinate": "cartesian",
      "status": "supported",
      "supported": [
        "square-root radius",
        "bounded radius",
        "color field",
        "frame filtering",
        "packed collision layout and labels",
        "absolute-area scale contract",
        "zero and negative policy",
        "explicit size guide"
      ],
      "p0": [],
      "p1": ["grouped pack", "grid and swarm", "explode and drill", "stable updates"],
      "p2": ["incremental worker layout"],
      "dependencies": ["label-layout-authoring", "incremental-worker-binary"]
    },
    {
      "id": "calendar",
      "coordinate": "calendar",
      "status": "supported",
      "supported": [
        "UTC year grid",
        "week by weekday cells",
        "month headers",
        "day hit targets",
        "year/month/week/day modes",
        "locale week start and timezone",
        "leap/no-data/zero policy",
        "month boundaries"
      ],
      "p0": [],
      "p1": ["multi-year and rolling calendars", "fiscal calendar", "brush and drill"],
      "p2": ["virtualized long ranges", "facets and events", "keyboard day navigation"],
      "dependencies": [
        "transform-dataflow",
        "analytic-interaction",
        "semantic-index-accessibility",
        "label-layout-authoring"
      ]
    },
    {
      "id": "candlestick",
      "coordinate": "financial",
      "status": "supported",
      "supported": [
        "candlestick",
        "OHLC and HLC",
        "hollow candle",
        "Heikin-Ashi",
        "OHLC aggregation",
        "session and timezone calendar",
        "gapless trading axis",
        "extended-hours policy",
        "navigator"
      ],
      "p0": [],
      "p1": [
        "volume and indicator panes",
        "crosshair",
        "events and drawing",
        "comparison and log price"
      ],
      "p2": ["stream grouping and history", "orders", "multiple price scales"],
      "dependencies": ["transform-dataflow", "composition-resolve", "incremental-worker-binary"]
    },
    {
      "id": "combination",
      "coordinate": "composite",
      "status": "supported",
      "supported": [
        "flat portable layers",
        "z-index",
        "independent x/x2/y/y2 domains",
        "closed Canvas layer/facet/repeat/concat/inset composition",
        "compatible shared primary x/y domains and independent child axes/legends",
        "scoped multi-view semantics and lineage",
        "Pareto preset",
        "named axes",
        "shared multi-view axes/legends/colorbars",
        "linked view state",
        "layer transforms",
        "layer clipping"
      ],
      "p0": [],
      "p1": [
        "linked overview and detail",
        "linked selections",
        "shared tooltip and crosshair",
        "mixed stacks",
        "facet pagination and virtualization"
      ],
      "p2": ["per-layer renderer", "dashboard actions", "streaming and Spatial composition"],
      "dependencies": [
        "composition-resolve",